{
  "attributeTypes": [],
  "edgeArchetypes": [
    {
      "name": "edge",
      "text": ""
    }
  ],
  "vertexArchetypes": [
    {
      "icon": "",
      "name": "1",
      "text": ""
    },
    {
      "icon": "",
      "name": "2",
      "text": ""
    },
    {
      "icon": "",
      "name": "3",
      "t[ext": ""
    },
    {
      "icon": "",
      "name": "4",
      "text": ""
    }
  ],
  "vertices": [
    {
      "archetype": 0,
      "attributes": [],
      "id": 1,
      "text": "",
      "name": "V1",
      "position": {
        "x": 1030,
        "y": 661
      }
    },
    {
      "archetype": 1,
      "attributes": [],
      "id": 2,
      "text": "",
      "name": "V2",
      "position": {
        "x": 985,
        "y": 871
      }
    },
    {
      "archetype": 1,
      "attributes": [],
      "id": 3,
      "text": "",
      "name": "V3",
      "position": {
        "x": 1088,
        "y": 416
      }
    },
    {
      "archetype": 3,
      "attributes": [],
      "id": 4,
      "text": "",
      "name": "V4",
      "position": {
        "x": 635,
        "y": 439
      }
    },
    {
      "archetype": 2,
      "attributes": [],
      "id": 5,
      "text": "",
      "name": "V5",
      "position": {
        "x": 609,
        "y": 758
      }
    }
  ],
  "edges": [
    {
      "subedgeInfo": [
        {
          "archetype": 0,
          "attributes": [],
          "id": 0
        }
      ],
      "from": 1,
      "to": 2,
      "text": "",
      "id": 1
    },
    {
      "subedgeInfo": [
        {
          "archetype": 0,
          "attributes": [],
          "id": 4
        }
      ],
      "from": 4,
      "to": 5,
      "text": "",
      "id": 2
    },
    {
      "subedgeInfo": [
        {
          "archetype": 0,
          "attributes": [],
          "id": 2
        }
      ],
      "from": 1,
      "to": 4,
      "text": "",
      "id": 3
    },
    {
      "subedgeInfo": [
        {
          "archetype": 0,
          "attributes": [],
          "id": 1
        }
      ],
      "from": 3,
      "to": 1,
      "text": "",
      "id": 4
    },
    {
      "subedgeInfo": [
        {
          "archetype": 0,
          "attributes": [],
          "id": 3
        }
      ],
      "from": 4,
      "to": 1,
      "text": "",
      "id": 5
    }
  ],
  "possibleEnumValues": {},
  "groups": [
    {
      "id": 3,
      "name": "Group X",
      "verticesId": [
        2,
        3,
        5
      ],
      "verticesEdgeFromId": [],
      "verticesEdgeToId": [],
      "position": {
        "x": 701,
        "y": 777
      }
    }
  ],
  "sideBar": [],
  "highlightedVertex": "",
  "highlightedEdge": ""
}