{
  "attributeTypes": [
    {
      "dataType": "STRING",
      "name": "D",
      "text": "0"
    },
    {
      "dataType": "STRING",
      "name": "C",
      "text": "1"
    },
    {
      "dataType": "STRING",
      "name": "B",
      "text": "2"
    },
    {
      "dataType": "STRING",
      "name": "A",
      "text": "3"
    }
  ],
  "edgeArchetypes": [
    {
      "name": "edgeArchetype1",
      "text": ""
    },
    {
      "name": "edgeArchetype2",
      "text": ""
    }
  ],
  "vertexArchetypes": [
    {
      "icon": "",
      "name": "1",
      "text": ""
    },
    {
      "icon": "",
      "name": "2",
      "text": ""
    },
    {
      "icon": "",
      "name": "3",
      "text": ""
    }
  ],
  "vertices": [
    {
      "archetype": 2,
      "attributes": [
        [
          "D",
          "E"
        ],
        [
          "B",
          "W"
        ],
        [
          "A",
          "Q"
        ]
      ],
      "id": 1,
      "text": "",
      "name": "V1",
      "position": {
        "x": 753.25,
        "y": 693.75
      }
    },
    {
      "archetype": 1,
      "attributes": [
        [
          "D",
          "E"
        ],
        [
          "C",
          "Q"
        ],
        [
          "B",
          "W"
        ]
      ],
      "id": 2,
      "text": "",
      "name": "V2",
      "position": {
        "x": 534.25,
        "y": 897.5
      }
    },
    {
      "archetype": 0,
      "attributes": [
        [
          "D",
          "Q"
        ],
        [
          "C",
          "W"
        ],
        [
          "A",
          "E"
        ]
      ],
      "id": 3,
      "text": "",
      "name": "V3",
      "position": {
        "x": 961.25,
        "y": 899.75
      }
    }
  ],
  "edges": [
    {
      "subedgeInfo": [
        {
          "archetype": 0,
          "attributes": [
            [
              "D",
              "E"
            ],
            [
              "C",
              "W"
            ]
          ],
          "id": 3
        }
      ],
      "from": 1,
      "to": 3,
      "text": "",
      "id": 1
    },
    {
      "subedgeInfo": [
        {
          "archetype": 0,
          "attributes": [
            [
              "D",
              "E"
            ],
            [
              "B",
              "W"
            ],
            [
              "A",
              "Q"
            ]
          ],
          "id": 1
        },
        {
          "archetype": 1,
          "attributes": [
            [
              "D",
              "D"
            ],
            [
              "B",
              "S"
            ],
            [
              "A",
              "A"
            ]
          ],
          "id": 2
        }
      ],
      "from": 1,
      "to": 2,
      "text": "",
      "id": 2
    },
    {
      "subedgeInfo": [
        {
          "archetype": 1,
          "attributes": [
            [
              "C",
              "T"
            ],
            [
              "B",
              "R"
            ]
          ],
          "id": 4
        }
      ],
      "from": 3,
      "to": 1,
      "text": "",
      "id": 3
    }
  ],
  "possibleEnumValues": {},
  "groups": [],
  "sideBar": [],
  "highlightedVertex": "",
  "highlightedEdge": ""
}