{"vertices":[{"attributes":[["test","test value"]],"id":0,"name":"A","archetype":0,"text":""},{"attributes":[["test","test value"]],"id":1,"name":"B","archetype":0,"text":""}],"edges":[{"subedgeInfo":[{"archetype":0,"id":0,"attributes":[["test","test value"]]}],"id":0,"from":0,"to":1,"text":"A-B"}],"vertexArchetypes":[{"name":"Vertex","text":"","icon":""}],"edgeArchetypes":[{"name":"Edge","text":""}],"attributeTypes":[{"name":"test","dataType":"STRING","text":""}],"possibleEnumValues":{},"groups":[],"sideBar":[],"highlightedVertex":"","highlightedEdge":""}