{
  "attributeTypes": [],
  "edgeArchetypes": [
    {
      "name": "edge",
      "text": ""
    }
  ],
  "vertexArchetypes": [
    {
      "icon": "<rect class=\"testingArchetypeIcon\" width=\"12\" height=\"15\" x=\"0\" y =\"0\" stroke=\"none\" fill=\"green\"/>",
      "name": "SpecifiedIcon",
      "text": ""
    },
    {
      "icon": "",
      "name": "UnspecifiedIcon",
      "text": ""
    },
    {
      "icon": "<text y=\"8\" fill=\"red\">â˜º</text>",
      "name": "Smiley",
      "text": ""
    }
  ],
  "vertices": [
    {
      "archetype": 0,
      "attributes": [],
      "id": 1,
      "text": "",
      "name": "Vertex with specified icon",
      "position": {
        "x": 640.5,
        "y": 408.25
      }
    },
    {
      "archetype": 1,
      "attributes": [],
      "id": 2,
      "text": "",
      "name": "Vertex with unspecified icon",
      "position": {
        "x": 826.25,
        "y": 536.75
      }
    },
    {
      "archetype": 2,
      "attributes": [],
      "id": 3,
      "text": "",
      "name": "Vertex with smiley as archetype icon",
      "position": {
        "x": 438,
        "y": 537.75
      }
    }
  ],
  "edges": [
    {
      "subedgeInfo": [
        {
          "archetype": 0,
          "attributes": [],
          "id": 1
        }
      ],
      "from": 1,
      "to": 3,
      "text": "",
      "id": 1
    },
    {
      "subedgeInfo": [
        {
          "archetype": 0,
          "attributes": [],
          "id": 0
        }
      ],
      "from": 1,
      "to": 2,
      "text": "",
      "id": 2
    }
  ],
  "possibleEnumValues": {},
  "groups": [],
  "sideBar": [],
  "highlightedVertex": "",
  "highlightedEdge": ""
}
